{
  "title": "",
  "genre": [],
  "tone": [],
  "pov_id": "",
  "boundaries": [],
  "start": {},
  "naming": {
    "origin": "foreign",
    "culture": "",
    "script": "cyrillic",
    "location_names_script": "cyrillic",
    "avoid_russian_names": true
  },
  "presentation": {
    "layout": "standard_novella",
    "header_enabled": true,
    "scene_body_min_chars": 1500,
    "scene_body_max_chars": 2500,
    "dialogue_format": "bold_name_italic_parenthetical_regular_speech",
    "guidance": {
      "enabled": true,
      "items_per_section": 3
    },
    "footer_state": true,
    "footer_relationships": true,
    "footer_turn": true
  },
  "prose_style": {
    "mode": "serious_literary",
    "seriousness": "serious",
    "description_detail": "detailed",
    "literary_density": "literary",
    "pace": "balanced",
    "directorial_irony": "subtle"
  },
  "relationship_preferences": [],
  "pov_control": {
    "allow_routine_actions": true,
    "allow_involuntary_reactions": true,
    "allow_minor_dialogue": true,
    "require_pov_presence": true,
    "user_only_consequential_choices": true
  }
}
